<?xml version="1.0" encoding="UTF-8"?>
<QLS xmlns:xsi="http://www.w3.org/2001/XMLSchema-instance"
 xsi:noNamespaceSchemaLocation="file:/D:/HK2-thirdYear/XML/repos/QLS.xsd">
    <LinhVuc>
        <MaLV>0000000</MaLV>
        <tenLinhVuc>tenLinhVuc0</tenLinhVuc>
        <MaS>AA00</MaS>
    </LinhVuc>
    <Sach>
        <tuaDe>tuaDe0</tuaDe>
        <MaS>AA00</MaS>
        <MaTG>AA00</MaTG>
    </Sach>
    <Sach>
        <tuaDe>tuaDe1</tuaDe>
        <MaS>AA01</MaS>
        <MaTG>AA00</MaTG>
    </Sach>
    <tacGia>
        <MaTG>AA00</MaTG>
        <tenTG>tenTG0</tenTG>
        <DC>DC0</DC>
        <SDT>+00a0000000000</SDT>
        <email>0@AaA</email>
    </tacGia>
    <tacGia>
        <MaTG>AA01</MaTG>
        <tenTG>tenTG1</tenTG>
        <DC>DC1</DC>
        <SDT>+00a0000000000</SDT>
        <email>0@AaA</email>
    </tacGia>
    <sangTac>
        <MaTG>AA00</MaTG>
        <MaS>AA00</MaS>
    </sangTac>
    <sangTac>
        <MaTG>AA00</MaTG>
        <MaS>AA00</MaS>
    </sangTac>
</QLS>
